{
  "api_version": 1,
  "description": "Capability registration contract: Sharecut Studio command/GUI/keyboard + MCP/CLI/skills.",
  "hub_skills": [
    "impeccable",
    "podcast-balance-levels",
    "podcast-chapter-markers",
    "podcast-cleanup-transcript",
    "podcast-focus-episode",
    "podcast-inaudible-cuts",
    "podcast-ingest-align",
    "podcast-mix-music",
    "podcast-mute-bleed",
    "podcast-pipeline-tune",
    "podcast-remote-mcp",
    "podcast-tighten-dialogue",
    "podcast-transcript-audition",
    "podcast-transcript-correct",
    "podcast-transcript-precorrect",
    "podcast-transcript-reconcile",
    "podcast-transcript-refine",
    "podcast-vocal-compression",
    "sharecut-poteto"
  ],
  "untracked_mcp": [],
  "capabilities": [
    {
      "id": "daw.transport.togglePlay",
      "label": "Play / pause",
      "effect": "session",
      "service": "Sharecut Studio command bus \u2192 services/document",
      "industry_standard_key": true,
      "gates": [
        "editorFocused"
      ],
      "surfaces": {
        "command": "transport.togglePlay",
        "gui": [
          "transport.play"
        ],
        "keyboard": "Space",
        "mcp": [
          "set_session_playing_tool",
          "play_audio_tool"
        ],
        "skill": "podcast-play-audition"
      },
      "omit": {},
      "tooltip": "Play / pause",
      "presence": {
        "cursor": "anchor",
        "follow": "look",
        "anchor": "transport:play"
      }
    },
    {
      "id": "daw.transport.seek",
      "label": "Seek playhead",
      "effect": "session",
      "service": "Sharecut Studio command bus \u2192 services/document",
      "industry_standard_key": false,
      "gates": [
        "always"
      ],
      "surfaces": {
        "command": "transport.seek",
        "mcp": [
          "seek_session_tool"
        ]
      },
      "omit": {
        "keyboard_reason": "not industry-standard; menu/toolbar or unkeyed"
      }
    },
    {
      "id": "daw.transport.stop",
      "label": "Stop playback",
      "effect": "session",
      "service": "Sharecut Studio command bus \u2192 services/document",
      "industry_standard_key": true,
      "gates": [
        "always"
      ],
      "surfaces": {
        "command": "transport.stop",
        "gui": [
          "transport.stop"
        ],
        "keyboard": "K",
        "mcp": [
          "stop_session_tool"
        ]
      },
      "omit": {},
      "tooltip": "Stop and return to where playback started",
      "presence": {
        "cursor": "anchor",
        "follow": "look",
        "anchor": "transport:stop"
      }
    },
    {
      "id": "daw.transport.audition",
      "label": "Audition Full mix / Edited stems / Original",
      "effect": "session",
      "service": "Sharecut Studio command bus",
      "industry_standard_key": false,
      "gates": [
        "hasProject"
      ],
      "surfaces": {
        "command": "transport.audition",
        "gui": [
          "transport.audition"
        ],
        "skill": "podcast-play-audition"
      },
      "omit": {
        "keyboard_reason": "not industry-standard; Full mix/Edited stems/Original toggle"
      },
      "tooltip": "Audition Full mix, Edited stems, or Original",
      "presence": {
        "cursor": "anchor",
        "follow": "hear",
        "guest_fallback": "banner",
        "anchor": "audition:<mode>"
      }
    },
    {
      "id": "daw.presence.follow",
      "label": "Follow",
      "effect": "session",
      "service": "Sharecut Studio command bus \u2192 services/session_sync",
      "industry_standard_key": false,
      "gates": [
        "always"
      ],
      "surfaces": {
        "command": "presence.follow",
        "gui": [
          "presence.avatarStack"
        ],
        "mcp": [
          "get_session_presence_tool"
        ]
      },
      "omit": {
        "keyboard_reason": "not industry-standard; avatar click"
      },
      "tooltip": "Follow this person",
      "presence": {
        "cursor": "none",
        "follow": "none"
      }
    },
    {
      "id": "daw.presence.unfollow",
      "label": "Stop following",
      "effect": "session",
      "service": "Sharecut Studio command bus \u2192 services/session_sync",
      "industry_standard_key": true,
      "gates": [
        "following"
      ],
      "surfaces": {
        "command": "presence.unfollow",
        "gui": [
          "presence.followBanner"
        ],
        "keyboard": "Escape"
      },
      "omit": {},
      "tooltip": "Stop following",
      "presence": {
        "cursor": "none",
        "follow": "none"
      }
    },
    {
      "id": "daw.tool.select",
      "label": "Select tool",
      "effect": "view",
      "service": "Sharecut Studio command bus \u2192 services/document",
      "industry_standard_key": true,
      "gates": [
        "timelineFocused"
      ],
      "surfaces": {
        "command": "tool.select",
        "gui": [
          "toolModeToggle"
        ],
        "keyboard": "V"
      },
      "omit": {},
      "tooltip": "Select tool",
      "presence": {
        "cursor": "none",
        "follow": "none"
      }
    },
    {
      "id": "daw.tool.blade",
      "label": "Blade tool",
      "effect": "view",
      "service": "Sharecut Studio command bus \u2192 services/document",
      "industry_standard_key": true,
      "gates": [
        "timelineAndStructural"
      ],
      "surfaces": {
        "command": "tool.blade",
        "gui": [
          "toolModeToggle"
        ],
        "keyboard": "C"
      },
      "omit": {},
      "tooltip": "Blade tool",
      "presence": {
        "cursor": "none",
        "follow": "none"
      }
    },
    {
      "id": "daw.review.exitCommentMode",
      "label": "Exit comment mode",
      "effect": "view",
      "service": "Sharecut Studio command bus \u2192 services/document",
      "industry_standard_key": false,
      "gates": [
        "commentMode"
      ],
      "surfaces": {
        "command": "review.exitCommentMode",
        "gui": [],
        "keyboard": "Escape"
      },
      "omit": {}
    },
    {
      "id": "daw.edit.clearSelection",
      "label": "Clear selection",
      "effect": "session",
      "service": "Sharecut Studio command bus \u2192 services/document",
      "industry_standard_key": true,
      "gates": [
        "hasInspectorSelection"
      ],
      "surfaces": {
        "command": "edit.clearSelection",
        "keyboard": "Escape"
      },
      "omit": {},
      "tooltip": "Clear selection"
    },
    {
      "id": "daw.review.toggleCommentMode",
      "label": "Toggle comment mode",
      "effect": "view",
      "service": "Sharecut Studio command bus \u2192 services/document",
      "industry_standard_key": true,
      "gates": [
        "always"
      ],
      "surfaces": {
        "command": "review.toggleCommentMode",
        "gui": [
          "transport.comment"
        ],
        "keyboard": "Mod+Shift+C"
      },
      "omit": {},
      "tooltip": "Toggle comment mode",
      "presence": {
        "cursor": "none",
        "follow": "none"
      }
    },
    {
      "id": "daw.review.resolveComment",
      "label": "Resolve comment",
      "effect": "project",
      "service": "Sharecut Studio command bus \u2192 comment patch service",
      "industry_standard_key": false,
      "gates": [
        "hostProjectLoaded"
      ],
      "surfaces": {
        "command": "comment.resolve",
        "gui": [
          "mobileShell.gesture.swipeLeftComment"
        ],
        "mcp": [
          "resolve_comment_tool"
        ],
        "cli": "podcast comment resolve",
        "touch": [
          "swipe-left"
        ]
      },
      "omit": {
        "guest": true,
        "keyboard_reason": "Direct comment card gesture and button; no standard shortcut"
      },
      "tooltip": "Resolve this comment",
      "presence": {
        "cursor": "none",
        "follow": "none"
      }
    },
    {
      "id": "daw.tighten.applyHit",
      "label": "Apply tighten hit",
      "effect": "project",
      "service": "Sharecut Studio command bus \u2192 ApproveEdits",
      "industry_standard_key": false,
      "gates": [
        "tightenPanelOpen"
      ],
      "surfaces": {
        "command": "tighten.applyHit",
        "gui": [
          "tightenPanel"
        ],
        "keyboard": "Enter",
        "mcp": [
          "approve_edits_tool"
        ],
        "cli": "podcast edit approve",
        "skill": "podcast-tighten-dialogue"
      },
      "omit": {},
      "tooltip": "Apply the selected tighten cut",
      "presence": {
        "cursor": "none",
        "follow": "none"
      }
    },
    {
      "id": "daw.tighten.skipHit",
      "label": "Skip tighten hit",
      "effect": "project",
      "service": "Sharecut Studio command bus \u2192 RejectEdits",
      "industry_standard_key": false,
      "gates": [
        "tightenPanelOpen"
      ],
      "surfaces": {
        "command": "tighten.skipHit",
        "gui": [
          "tightenPanel"
        ],
        "keyboard": "Backspace",
        "mcp": [
          "reject_edits_tool"
        ],
        "cli": "podcast edit reject",
        "skill": "podcast-tighten-dialogue"
      },
      "omit": {},
      "tooltip": "Skip the selected tighten cut",
      "presence": {
        "cursor": "none",
        "follow": "none"
      }
    },
    {
      "id": "daw.tighten.applySuggested",
      "label": "Apply suggested actions",
      "effect": "project",
      "service": "Sharecut Studio command bus \u2192 ApplySuggestedActions",
      "industry_standard_key": false,
      "gates": [
        "tightenPanelOpen"
      ],
      "surfaces": {
        "command": "tighten.applySuggested",
        "gui": [
          "tightenPanel"
        ],
        "keyboard": "Mod+Shift+Enter",
        "mcp": [
          "apply_suggested_actions_tool"
        ],
        "cli": "podcast edit apply-suggested",
        "skill": "podcast-tighten-dialogue"
      },